{
  "id": "cap",
  "title": "Auto-capture on wall-hit",
  "category": "Tooling",
  "status": "idea",
  "session": {
    "type": "none",
    "ref": null
  },
  "resume": {
    "last": "Branched off the skill thread - 'what if parking were automatic?'",
    "next": "Detect 'I'm stuck' phrasing -> offer to park"
  },
  "blocker": {
    "type": "none"
  },
  "triage": {
    "priority": 3,
    "effort": "M",
    "energy": "deep"
  },
  "edges": [
    {
      "to": "skill",
      "kind": "branch"
    }
  ],
  "doneWhen": [
    "Wall-hits get captured without me remembering to"
  ],
  "pos": {
    "x": 830,
    "y": 170
  }
}
